{
  "schemaVersion": 1,
  "name": "sandbox-docker",
  "version": "0.1.1",
  "publisher": "Capybara",
  "description": "Conversation sandboxes (sandbox@1) as Docker containers (runc or gVisor runsc) behind a Docker socket proxy, with an egress allowlist proxy",
  "homepage": "https://github.com/capybara-hq/core/tree/main/plugins/sandbox-docker#readme"
}
