{
  "schemaVersion": 1,
  "name": "connector-mcp",
  "version": "0.2.0",
  "publisher": "Capybara",
  "description": "MCP connector (connector@1): tools and resources of remote MCP servers over Streamable HTTP",
  "homepage": "https://github.com/capybara-hq/core/tree/main/plugins/connector-mcp#readme"
}
