{
  "schemaVersion": 1,
  "name": "connector-openapi",
  "version": "0.1.1",
  "publisher": "Capybara",
  "description": "OpenAPI connector (connector@1): one tool per operation of an OpenAPI 3.0 / 3.1 HTTP API",
  "homepage": "https://github.com/capybara-hq/core/tree/main/plugins/connector-openapi#readme"
}
