{
  "schemaVersion": 1,
  "name": "anthropic",
  "version": "0.1.1",
  "publisher": "Capybara",
  "description": "Anthropic model provider (model-provider@2) using the official SDK and the native Messages API",
  "homepage": "https://github.com/capybara-hq/core/tree/main/plugins/anthropic#readme"
}
